{
  "version": "1.0.0",
  "enabled": true,

  "llm": {
    "provider": "gemini",
    "models": {
      "primary": "gemini/gemini-2.0-flash-exp",
      "fallback": "claude-3-haiku-20240307",
      "local": "ollama/llama3.2"
    },
    "api_keys": {
      "gemini": "${GEMINI_API_KEY}",
      "anthropic": "${ANTHROPIC_API_KEY}",
      "openai": "${OPENAI_API_KEY}"
    },
    "parameters": {
      "max_tokens": 100,
      "temperature": 0.3,
      "timeout": 10
    },
    "cost_control": {
      "daily_limit_usd": 0.10,
      "usage_tracking": true,
      "usage_file": "~/.claude/voice-usage.json"
    }
  },

  "voice": {
    "engine": "macos_say",
    "voice_name": "Ting-Ting",
    "rate": 200,
    "volume": 75,
    "max_summary_length": 50,
    "async": true
  },

  "triggers": {
    "on_completion": true,
    "on_error": true,
    "min_duration_seconds": 0,
    "error_keywords": [
      "Error:",
      "Failed:",
      "Exception:",
      "FAILED",
      "fatal"
    ]
  },

  "summarization": {
    "language": "zh-TW",
    "format": "concise",
    "include": {
      "operation_type": true,
      "result_status": true,
      "key_data": true,
      "next_steps": true
    },
    "prompt_template": "Summarize the Claude Code output in Traditional Chinese, max {max_length} characters. Include: 1) operation type 2) result status 3) key data 4) next steps. Context: {context}"
  },

  "logging": {
    "enabled": true,
    "log_file": "~/.claude/logs/voice-notifications.log",
    "log_level": "INFO",
    "rotate": true,
    "max_size_mb": 10
  },

  "advanced": {
    "cache_summaries": false,
    "cache_ttl_seconds": 3600,
    "retry_attempts": 3,
    "fallback_message": "Claude Code task completed"
  }
}
